{
  "manufacturer": "Voron",
  "model": "0.2",
  "technology": "FDM",
  "status": "current",
  "specs": {
    "build_volume_cm3": 1728,
    "power_w": 200,
    "heater_power_w": 120
  },
  "cost": {
    "typical_price_eur": 350,
    "maintenance_eur_year": 40
  },
  "sources": [
    "stimalo overlay (community)"
  ],
  "temperatures": {
    "typical_bed_temp": 110,
    "typical_nozzle_temp": 260
  },
  "contributed_by": "swordlab"
}
