{
  "manufacturer": "Anycubic",
  "model": "Kobra 2 Plus",
  "technology": "FDM",
  "status": "current",
  "specs": {
    "build_volume_cm3": 40960,
    "nozzle_diameter_mm": 0.4,
    "max_speed_mm_s": 500,
    "power_w": 350,
    "heater_power_w": 250
  },
  "cost": {
    "typical_price_eur": 349,
    "maintenance_eur_year": 30
  },
  "sources": [
    "stimalo overlay (community)"
  ],
  "temperatures": {
    "typical_bed_temp": 60,
    "typical_nozzle_temp": 210
  },
  "contributed_by": "swordlab"
}
