{
  "manufacturer": "Kingroon",
  "model": "KP3S Pro V2",
  "technology": "FDM",
  "status": "current",
  "specs": {
    "power_w": 200,
    "heater_power_w": 150
  },
  "cost": {
    "typical_price_eur": 169,
    "maintenance_eur_year": 30
  },
  "sources": [
    "stimalo overlay (community)"
  ],
  "temperatures": {
    "typical_bed_temp": 60,
    "typical_nozzle_temp": 200
  },
  "contributed_by": "swordlab"
}
