{
  "manufacturer": "Elegoo Neptune",
  "model": "4 Max",
  "technology": "FDM",
  "status": "current",
  "specs": {
    "build_volume_cm3": 84672,
    "power_w": 500,
    "heater_power_w": 350
  },
  "cost": {
    "typical_price_eur": 399,
    "maintenance_eur_year": 65
  },
  "sources": [
    "stimalo overlay (community)"
  ],
  "temperatures": {
    "typical_bed_temp": 80,
    "typical_nozzle_temp": 260
  },
  "contributed_by": "swordlab"
}
