{
  "manufacturer": "Bambu Lab",
  "model": "X1 Carbon",
  "technology": "FDM",
  "status": "current",
  "specs": {
    "power_w": 1000,
    "heater_power_w": 350
  },
  "cost": {
    "typical_price_eur": 1199,
    "maintenance_eur_year": 100
  },
  "sources": [
    "stimalo overlay (community)"
  ],
  "temperatures": {
    "typical_bed_temp": 80,
    "typical_nozzle_temp": 220
  },
  "contributed_by": "swordlab"
}
