{
  "manufacturer": "Longer",
  "model": "LK5 Pro",
  "technology": "FDM",
  "status": "current",
  "specs": {
    "build_volume_cm3": 36000,
    "nozzle_diameter_mm": 0.4,
    "power_w": 360,
    "heater_power_w": 250
  },
  "cost": {
    "typical_price_eur": 249,
    "maintenance_eur_year": 45
  },
  "sources": [
    "stimalo overlay (community)"
  ],
  "temperatures": {
    "typical_bed_temp": 60,
    "typical_nozzle_temp": 210
  },
  "contributed_by": "swordlab"
}
