{
  "manufacturer": "UniFormation",
  "model": "GKtwo",
  "technology": "FDM",
  "status": "current",
  "specs": {
    "build_volume_mm": {
      "x": 228.1,
      "y": 128.3,
      "z": 245.0
    },
    "build_volume_cm3": 7169.6,
    "power_w": 60,
    "resolution_x": 7680,
    "resolution_y": 4320,
    "pixel_size_um": 29.7
  },
  "cost": {
    "typical_price_eur": 349,
    "maintenance_eur_year": 55
  },
  "sources": [
    "stimalo overlay (community)"
  ],
  "contributed_by": "swordlab"
}
