{
  "manufacturer": "Bambu Lab",
  "model": "A1 Mini",
  "technology": "FDM",
  "status": "current",
  "specs": {
    "power_w": 500,
    "heater_power_w": 200
  },
  "cost": {
    "typical_price_eur": 299,
    "maintenance_eur_year": 50
  },
  "sources": [
    "stimalo overlay (community)"
  ],
  "temperatures": {
    "typical_bed_temp": 65,
    "typical_nozzle_temp": 220
  },
  "contributed_by": "swordlab"
}
